Item Title,Publication Title,Book Series Title,Journal Volume,Journal Issue,Item DOI,Authors,Publication Year,URL,Content Type
Ebola and Accusation: How Gender and Stigmatization Prolonged the Epidemic in Sierra Leone,Pregnant in the Time of Ebola,,,,10.1007/978-3-319-97637-2_28,Olive Melissa Minor,2019,https://link.springer.com/chapter/10.1007/978-3-319-97637-2_28,Chapter
Integrating UML and ALF: An Approach to Overcome the Code Generation Dilemma in Model-Driven Software Engineering,Model-Driven Engineering and Software Development,,,,10.1007/978-3-030-37873-8_1,Johannes SchröpferThomas Buchmann,2020,https://link.springer.com/chapter/10.1007/978-3-030-37873-8_1,Conference paper
Webpages Classification with Phishing Content Using Naive Bayes Algorithm,Knowledge Management in Organizations,,,,10.1007/978-3-030-21451-7_21,Jorge Enrique Rodríguez RodríguezVíctor Hugo Medina GarcíaNelson Pérez Castillo,2019,https://link.springer.com/chapter/10.1007/978-3-030-21451-7_21,Conference paper
Students’ Performance Prediction Model Using Meta-classifier Approach,Engineering Applications of Neural Networks,,,,10.1007/978-3-030-20257-6_19,Hasniza HassanSyahid AnuarNor Bahiah Ahmad,2019,https://link.springer.com/chapter/10.1007/978-3-030-20257-6_19,Conference paper
Malware and Persistence,Cyber Operations,,,,10.1007/978-1-4842-4294-0_11,Mike O’Leary,2019,https://link.springer.com/chapter/10.1007/978-1-4842-4294-0_11,Chapter
Chain-Free String Constraints,Automated Technology for Verification and Analysis,,,,10.1007/978-3-030-31784-3_16,Parosh Aziz AbdullaMohamed Faouzi AtigBui Phi DiepLukáš HolíkPetr Janků,2019,https://link.springer.com/chapter/10.1007/978-3-030-31784-3_16,Conference paper
Parsing and Creating JSON Objects with Gson,Java XML and JSON,,,,10.1007/978-1-4842-4330-5_9,Jeff Friesen,2019,https://link.springer.com/chapter/10.1007/978-1-4842-4330-5_9,Chapter
The Apache Web Server,Web-Based Projects that Rock the Class,,,,10.1007/978-1-4842-4463-0_1,Christos Karayiannis,2019,https://link.springer.com/chapter/10.1007/978-1-4842-4463-0_1,Chapter
Impact of Pretreatment Technologies for Biomass to Biofuel Production,Substrate Analysis for Effective Biofuels Production,,,,10.1007/978-981-32-9607-7_7,Sanjay Sahay,2020,https://link.springer.com/chapter/10.1007/978-981-32-9607-7_7,Chapter
OpenMobileNetwork – A Platform for Providing Semantically Enriched Network Data,Semantic Modeling and Enrichment of Mobile and WiFi Network Data,,,,10.1007/978-3-319-90769-7_6,Abdulbaki Uzun,2019,https://link.springer.com/chapter/10.1007/978-3-319-90769-7_6,Chapter
Extracting JSON Values with JsonPath,Java XML and JSON,,,,10.1007/978-1-4842-4330-5_10,Jeff Friesen,2019,https://link.springer.com/chapter/10.1007/978-1-4842-4330-5_10,Chapter
Next Steps,Developing Games on the Raspberry Pi,,,,10.1007/978-1-4842-4170-7_14,Seth Kenlon,2019,https://link.springer.com/chapter/10.1007/978-1-4842-4170-7_14,Chapter
Making a Simple Sandwich with JAMstack,Practical JAMstack,,,,10.1007/978-1-4842-6177-4_2,Frank Zammetti,2020,https://link.springer.com/chapter/10.1007/978-1-4842-6177-4_2,Chapter
Development and Developmental Disorders of the Forebrain,Clinical Neuroembryology,,,,10.1007/978-3-031-26098-8_9,Hans J. ten DonkelaarMartin LammensJohannes R. M. CruysbergKarin Kamphuis-van UlzenAkira HoriKohei ShiotaKyoko ItohMichèl Willemsen,2023,https://link.springer.com/chapter/10.1007/978-3-031-26098-8_9,Chapter
IoT Cargo Weight Tracking System for Supply Chains,Computational Logistics,,,,10.1007/978-3-030-31140-7_23,Diego GomezCesar ViloriaSteven LlerenaNel Tinoco,2019,https://link.springer.com/chapter/10.1007/978-3-030-31140-7_23,Conference paper
EULEX in Kosovo: EULEKSPERIMENT,The European Union’s Brand of Peacebuilding,,,,10.1007/978-3-030-19890-9_6,Birgit Poopuu,2020,https://link.springer.com/chapter/10.1007/978-3-030-19890-9_6,Chapter
A Graphical Front-End Interface for React.js,Advances in Network-Based Information Systems,,,,10.1007/978-3-319-98530-5_79,Shotaro NaikiMasaki KohanaShusuke OkamotoMasaru Kamada,2019,https://link.springer.com/chapter/10.1007/978-3-319-98530-5_79,Conference paper
Are Third-Party Libraries Secure? A Software Library Checker for Java,Risks and Security of Internet and Systems,,,,10.1007/978-3-030-12143-3_2,Fabien Patrick ViertelFabian KortumLeif WagnerKurt Schneider,2019,https://link.springer.com/chapter/10.1007/978-3-030-12143-3_2,Conference paper
Automatically Learning a Human-Resource Ontology from Professional Social-Network Data,Advances in Artificial Intelligence,,,,10.1007/978-3-030-18305-9_11,David Alfonso-HermeloPhilippe LanglaisLudovic Bourg,2019,https://link.springer.com/chapter/10.1007/978-3-030-18305-9_11,Conference paper
Inputs to Ring,Beginning Ring Programming,,,,10.1007/978-1-4842-5833-0_3,Mansour Ayouni,2020,https://link.springer.com/chapter/10.1007/978-1-4842-5833-0_3,Chapter
Interoperability Between SaaS and Data Layers: Enhancing the MIDAS Middleware,Cloud Computing and Services Science,,,,10.1007/978-3-030-29193-8_6,Elivaldo Lozer Fracalossi RibeiroMarcelo Aires VieiraDaniela Barreiro ClaroNathale Silva,2019,https://link.springer.com/chapter/10.1007/978-3-030-29193-8_6,Conference paper
"Revolutions 1916/1917: Lynd, War Issues, the ITGWU","Bernard Shaw, Sean O’Casey, and the Dead James Connolly",,,,10.1007/978-3-030-74274-4_3,Nelson O’Ceallaigh Ritschel,2021,https://link.springer.com/chapter/10.1007/978-3-030-74274-4_3,Chapter
Age-Related Macular Degeneration (AMD): Non-neovascular and Neovascular AMD,Albert and Jakobiec's Principles and Practice of Ophthalmology,,,,10.1007/978-3-319-90495-5_111-1,Voraporn ChaikitmongkolSusan B. BresslerNeil M. Bressler,2020,https://link.springer.com/rwe/10.1007/978-3-319-90495-5_111-1,Living reference work entry
React,JavaScript Frameworks for Modern Web Development,,,,10.1007/978-1-4842-4995-6_13,Sufyan bin UzayrNicholas CloudTim Ambler,2019,https://link.springer.com/chapter/10.1007/978-1-4842-4995-6_13,Chapter
CoRA: An Online Intelligent Tutoring System to Practice Coverability Graph Construction,Application and Theory of Petri Nets and Concurrency,,,,10.1007/978-3-030-21571-2_6,Jan Martijn E. M. van der WerfLucas Steehouwer,2019,https://link.springer.com/chapter/10.1007/978-3-030-21571-2_6,Conference paper
Micro-hydro Power System,Sustainable Energy Solutions for Remote Areas in the Tropics,,,,10.1007/978-3-030-41952-3_6,Alvin B. CulabaIsidro Antonio V. Marfori,2020,https://link.springer.com/chapter/10.1007/978-3-030-41952-3_6,Chapter
Regular Expressions in Python,Advanced Guide to Python 3 Programming,,,,10.1007/978-3-030-25943-3_22,John Hunt,2019,https://link.springer.com/chapter/10.1007/978-3-030-25943-3_22,Chapter
SemiTagRec: A Semi-supervised Learning Based Tag Recommendation Approach for Docker Repositories,Reuse in the Big Data Era,,,,10.1007/978-3-030-22888-0_10,Jiahong ZhouWei ChenGuoquan WuJun Wei,2019,https://link.springer.com/chapter/10.1007/978-3-030-22888-0_10,Conference paper
Push Data to Browsers and Micro-services with WebSocket,Expert Twisted,,,,10.1007/978-1-4842-3742-7_8,Mark WilliamsCory BenfieldBrian WarnerMoshe ZadkaDustin MitchellKevin SamuelPierre Tardy,2019,https://link.springer.com/chapter/10.1007/978-1-4842-3742-7_8,Chapter
Finding HTML and SQL Injection Vulnerabilities,Bug Bounty Hunting for Web Security,,,,10.1007/978-1-4842-5391-5_10,Sanjib Sinha,2019,https://link.springer.com/chapter/10.1007/978-1-4842-5391-5_10,Chapter
Prelude to the Green Movement,The Iranian Reform Movement,,,,10.1007/978-3-319-90969-1_10,Majid Mohammadi,2019,https://link.springer.com/chapter/10.1007/978-3-319-90969-1_10,Chapter
ULearn: Personalized Medical Learning on the Web for Patient Empowerment,Advances in Web-Based Learning – ICWL 2019,,,,10.1007/978-3-030-35758-0_20,Marco AlfanoBiagio LenzittiDavide TaibiMarkus Helfert,2019,https://link.springer.com/chapter/10.1007/978-3-030-35758-0_20,Conference paper
Maritime Transport: The Sustainability Imperative,Sustainable Shipping,,,,10.1007/978-3-030-04330-8_1,Hassiba BenamaraJan HoffmannFrida Youssef,2019,https://link.springer.com/chapter/10.1007/978-3-030-04330-8_1,Chapter
Seizing the Wheel,The Scientific World of Karl-Friedrich Bonhoeffer,,,,10.1007/978-3-319-95801-9_7,Kathleen L. Housley,2019,https://link.springer.com/chapter/10.1007/978-3-319-95801-9_7,Chapter
Web-Based 24-h Dietary Recall: The SACANA Program,Instruments for Health Surveys in Children and Adolescents,,,,10.1007/978-3-319-98857-3_5,Antje HebestreitMaike WoltersHannah JilaniGabriele EibenValeria Pala,2019,https://link.springer.com/chapter/10.1007/978-3-319-98857-3_5,Chapter
Introduction,Grain by Grain,,,,10.5822/978-1-61091-996-8_1,Bob QuinnLiz Carlisle,2019,https://link.springer.com/chapter/10.5822/978-1-61091-996-8_1,Chapter
Trauma and Its Trajectory in Criminal Behaviors: Case Study Exercise Assignments,Assessing Trauma in Forensic Contexts,,,,10.1007/978-3-030-33106-1_21,Rafael Art. JavierElizabeth A. OwenJemour A. Maddux,2020,https://link.springer.com/chapter/10.1007/978-3-030-33106-1_21,Chapter
Secured Remote Control of Greenhouse Based on Wireless Sensor Network and Multi Agent Systems,Advanced Intelligent Systems for Sustainable Development (AI2SD’2018),,,,10.1007/978-3-030-12065-8_38,Kamal MoummadiRachida AbidarHicham MedromiAhmed Ziani,2019,https://link.springer.com/chapter/10.1007/978-3-030-12065-8_38,Conference paper
From Marxism to Ontology: Maurice Merleau-Ponty,The Marxian Legacy,,,,10.1007/978-3-030-04411-4_7,Dick Howard,2019,https://link.springer.com/chapter/10.1007/978-3-030-04411-4_7,Chapter
A Model-Driven Method for Fast Building Consistent Web Services from OpenAPI-Compatible Models,Model-Driven Engineering and Software Development,,,,10.1007/978-3-030-11030-7_2,David SferruzzaJérôme RocheteauChristian AttiogbéArnaud Lanoix,2019,https://link.springer.com/chapter/10.1007/978-3-030-11030-7_2,Conference paper
E-Business Models in Tourism,Handbook of e-Tourism,,,,10.1007/978-3-030-05324-6_71-1,Stephan ReinholdFlorian J. ZachChristian Laesser,2020,https://link.springer.com/rwe/10.1007/978-3-030-05324-6_71-1,Living reference work entry
A Framework for the Development of Serious Games for Assessment,Games and Learning Alliance,,,,10.1007/978-3-030-34350-7_39,Fatima HamiyeBilal SaidBader Serhan,2019,https://link.springer.com/chapter/10.1007/978-3-030-34350-7_39,Conference paper
Right Intention,Lead with Heart in Mind,,,,10.1007/978-3-030-17028-8_4,Joan Marques,2019,https://link.springer.com/chapter/10.1007/978-3-030-17028-8_4,Chapter
The Role of Cloud-Based mHealth Disease Surveillance System in Regional Integration: A Case of the Ebola Crisis in ECOWAS,"Innovation, Regional Integration, and Development in Africa",,,,10.1007/978-3-319-92180-8_12,Lang LoumDikeledi A. Mokoena,2019,https://link.springer.com/chapter/10.1007/978-3-319-92180-8_12,Chapter
Azure Integration,Customizing Dynamics 365,,,,10.1007/978-1-4842-4379-4_6,Sanjaya Yapa,2019,https://link.springer.com/chapter/10.1007/978-1-4842-4379-4_6,Chapter
Semantic Support for Scenarios to Improve Communication in Agribusiness,Collaborative Networks and Digital Transformation,,,,10.1007/978-3-030-28464-0_38,Leandro AntonelliDiego TorresMariángeles HozikianJorge E. Hernandez,2019,https://link.springer.com/chapter/10.1007/978-3-030-28464-0_38,Conference paper
Error Metric Computation for Approximate Combinational Circuits,Design Automation Techniques for Approximation Circuits,,,,10.1007/978-3-319-98965-5_3,Arun ChandrasekharanDaniel GroßeRolf Drechsler,2019,https://link.springer.com/chapter/10.1007/978-3-319-98965-5_3,Chapter
Conclusion: The Future of Rap Discourses in America’s Colonies,Rap and Politics,,,,10.1057/978-1-137-60011-0_5,Lavar Pope,2020,https://link.springer.com/chapter/10.1057/978-1-137-60011-0_5,Chapter
The EZ:Faast Family of Amino Acid Analysis Kits: Application of the GC-FID Kit for Rapid Determination of Plasma Tryptophan and Other Amino Acids,Amino Acid Analysis,,,,10.1007/978-1-4939-9639-1_10,Abdulla A.-B. Badawy,2019,https://link.springer.com/chapter/10.1007/978-1-4939-9639-1_10,Protocol
"Data Collection, Analysis, and Interpretation",Research for Medical Imaging and Radiation Sciences,,,,10.1007/978-3-030-79956-4_6,Mark F. McEntee,2021,https://link.springer.com/chapter/10.1007/978-3-030-79956-4_6,Chapter
Small Baltic States: Sensitivities and Vulnerabilities,Small Baltic States and the Euro-Atlantic Security Community,,,,10.1007/978-3-030-53763-0_2,Sandis Sraders,2021,https://link.springer.com/chapter/10.1007/978-3-030-53763-0_2,Chapter
Web and Browser Security,Computer Security and the Internet,,,,10.1007/978-3-030-33649-3_9,Paul C. van Oorschot,2020,https://link.springer.com/chapter/10.1007/978-3-030-33649-3_9,Chapter
Transport Layer Security Protocol,Protocols for Authentication and Key Establishment,,,,10.1007/978-3-662-58146-9_6,Colin BoydAnish MathuriaDouglas Stebila,2020,https://link.springer.com/chapter/10.1007/978-3-662-58146-9_6,Chapter
Survey Methods,Empirical Social Research,,,,10.1007/978-3-658-37907-0_6,Michael Häder,2022,https://link.springer.com/chapter/10.1007/978-3-658-37907-0_6,Chapter
Servlets and JavaServer Pages,Jakarta EE Recipes,,,,10.1007/978-1-4842-5587-2_1,Josh Juneau,2020,https://link.springer.com/chapter/10.1007/978-1-4842-5587-2_1,Chapter
Secure Coding and Design,Oracle Database Application Security,,,,10.1007/978-1-4842-5367-0_6,Osama MustafaRobert P. Lockard,2019,https://link.springer.com/chapter/10.1007/978-1-4842-5367-0_6,Chapter
Advanced Persistent Threats and Zero-Day Exploits in Industrial Internet of Things,Security and Privacy Trends in the Industrial Internet of Things,,,,10.1007/978-3-030-12330-7_3,Ioannis StelliosPanayiotis KotzanikolaouMihalis Psarakis,2019,https://link.springer.com/chapter/10.1007/978-3-030-12330-7_3,Chapter
Migrate to a Host and Back Up Your Website Database,"Practical PHP 7, MySQL 8, and MariaDB Website Databases",,,,10.1007/978-1-4842-3843-1_7,Adrian W. WestSteve Prettyman,2018,https://link.springer.com/chapter/10.1007/978-1-4842-3843-1_7,Chapter
What Is Programming?,Learning C# by Programming Games,,,,10.1007/978-3-662-59252-6_2,Wouter van TollArjan EggesJeroen D. Fokker,2019,https://link.springer.com/chapter/10.1007/978-3-662-59252-6_2,Chapter
An Implementation of Interactive RFID Positioning Healthcare System on Mobile Platform,"Advances on Broadband and Wireless Computing, Communication and Applications",,,,10.1007/978-3-030-02613-4_31,Kuang-Yen TaiShun-Li YenTzer-Shyong ChenYu-Hsuan Tseng,2019,https://link.springer.com/chapter/10.1007/978-3-030-02613-4_31,Conference paper
Learning Swift and Xcode,Swift 5 for Absolute Beginners,,,,10.1007/978-1-4842-4868-3_6,Stefan KaczmarekBrad LeesGary Bennett,2019,https://link.springer.com/chapter/10.1007/978-1-4842-4868-3_6,Chapter
Expand and Enrich Your Website,"Practical PHP 7, MySQL 8, and MariaDB Website Databases",,,,10.1007/978-1-4842-3843-1_5,Adrian W. WestSteve Prettyman,2018,https://link.springer.com/chapter/10.1007/978-1-4842-3843-1_5,Chapter
Prototyping and environments,Advanced Python Development,,,,10.1007/978-1-4842-5793-7_1,Matthew Wilkes,2020,https://link.springer.com/chapter/10.1007/978-1-4842-5793-7_1,Chapter
Create a Message Board,"Practical PHP 7, MySQL 8, and MariaDB Website Databases",,,,10.1007/978-1-4842-3843-1_10,Adrian W. WestSteve Prettyman,2018,https://link.springer.com/chapter/10.1007/978-1-4842-3843-1_10,Chapter
The Making of a Monarchical Republic: The Undoing of Presidential Term Limits in Gabon Under Omar Bongo,The Politics of Challenging Presidential Term Limits in Africa,,,,10.1007/978-3-030-40810-7_3,Daniel Mengara,2020,https://link.springer.com/chapter/10.1007/978-3-030-40810-7_3,Chapter
Create Login/Logout Functionality for Members and an Administrator,"Practical PHP 7, MySQL 8, and MariaDB Website Databases",,,,10.1007/978-1-4842-3843-1_3,Adrian W. WestSteve Prettyman,2018,https://link.springer.com/chapter/10.1007/978-1-4842-3843-1_3,Chapter
E-commerce: A Brief Introduction,"Practical PHP 7, MySQL 8, and MariaDB Website Databases",,,,10.1007/978-1-4842-3843-1_11,Adrian W. WestSteve Prettyman,2018,https://link.springer.com/chapter/10.1007/978-1-4842-3843-1_11,Chapter
Kraken,JavaScript Frameworks for Modern Web Development,,,,10.1007/978-1-4842-4995-6_8,Sufyan bin UzayrNicholas CloudTim Ambler,2019,https://link.springer.com/chapter/10.1007/978-1-4842-4995-6_8,Chapter
Arrays,PHP 7 Zend Certification Study Guide,,,,10.1007/978-1-4842-3246-0_4,Andrew Beak,2017,https://link.springer.com/chapter/10.1007/978-1-4842-3246-0_4,Chapter
Proteomic Detection of Carbohydrate-Active Enzymes (CAZymes) in Microbial Secretomes,Functional Proteomics,,,,10.1007/978-1-4939-8814-3_12,Tina R. TuvengVincent G. H. EijsinkMagnus Ø. Arntzen,2019,https://link.springer.com/chapter/10.1007/978-1-4939-8814-3_12,Protocol
Constructive Game Logic,Programming Languages and Systems,,,,10.1007/978-3-030-44914-8_4,Rose BohrerAndré Platzer,2020,https://link.springer.com/chapter/10.1007/978-3-030-44914-8_4,Conference paper
PRONOM: Proof-Search and Countermodel Generation for Non-normal Modal Logics,AI*IA 2019 – Advances in Artificial Intelligence,,,,10.1007/978-3-030-35166-3_12,Tiziano DalmonteSara NegriNicola OlivettiGian Luca Pozzato,2019,https://link.springer.com/chapter/10.1007/978-3-030-35166-3_12,Conference paper
Create and Test a Database and Table,"Practical PHP 7, MySQL 8, and MariaDB Website Databases",,,,10.1007/978-1-4842-3843-1_1,Adrian W. WestSteve Prettyman,2018,https://link.springer.com/chapter/10.1007/978-1-4842-3843-1_1,Chapter
Create an Administration Interface,"Practical PHP 7, MySQL 8, and MariaDB Website Databases",,,,10.1007/978-1-4842-3843-1_4,Adrian W. WestSteve Prettyman,2018,https://link.springer.com/chapter/10.1007/978-1-4842-3843-1_4,Chapter
Having a Place of One’s Own: Doing a Feminist Ethnography of the Swiss Shooting Museum’s Archives,Histories of Women's Work in Global Sport,,,,10.1007/978-3-030-26909-8_8,Solène Froidevaux,2019,https://link.springer.com/chapter/10.1007/978-3-030-26909-8_8,Chapter
The Modeling of a Programming Language Syntax Based on Positional Entropy,Computer Information Systems and Industrial Management,,,,10.1007/978-3-030-28957-7_33,Marcin Cholewa,2019,https://link.springer.com/chapter/10.1007/978-3-030-28957-7_33,Conference paper
Statistical Applications,Weak Convergence and Empirical Processes,,,,10.1007/978-3-031-29040-4_3,A. W. van der  VaartJon A. Wellner,2023,https://link.springer.com/chapter/10.1007/978-3-031-29040-4_3,Chapter
LocalPKI: An Interoperable and IoT Friendly PKI,E-Business and Telecommunications,,,,10.1007/978-3-030-11039-0_11,Jean-Guillaume DumasPascal LafourcadeFrancis MelemedjianJean-Baptiste OrfilaPascal Thoniel,2019,https://link.springer.com/chapter/10.1007/978-3-030-11039-0_11,Conference paper
Geopolitics of the Coronavirus,The Science and Politics of Covid-19,,,,10.1007/978-3-030-77864-4_3,Michel Claessens,2021,https://link.springer.com/chapter/10.1007/978-3-030-77864-4_3,Chapter
Authentication and Authorization,Introduction to Data Systems,,,,10.1007/978-3-030-54371-6_24,Thomas BressoudDavid White,2020,https://link.springer.com/chapter/10.1007/978-3-030-54371-6_24,Chapter
"A Youth Between Defeat and Liberation, 1806–1830",Prussian Conservatism 1815-1856,,,,10.1007/978-3-030-81070-2_2,Laura Claudia Achtelstetter,2021,https://link.springer.com/chapter/10.1007/978-3-030-81070-2_2,Chapter
"Prediction, Analysis, Visualization, and Storage of Protein–Protein Interactions Using Computational Approaches",Protein-Protein Interactions,,,,10.1007/978-981-16-1594-8_6,Krishna Mohan PoluriKhushboo GulatiSharanya Sarkar,2021,https://link.springer.com/chapter/10.1007/978-981-16-1594-8_6,Chapter
Error and Exception Handling,Beginning PHP and MySQL,,,,10.1007/978-1-4302-6044-8_8,Frank M. Kromann,2018,https://link.springer.com/chapter/10.1007/978-1-4302-6044-8_8,Chapter
Generic CP-Supported CMSA for Binary Integer Linear Programs,Hybrid Metaheuristics,,,,10.1007/978-3-030-05983-5_1,Christian BlumHaroldo Gambini Santos,2019,https://link.springer.com/chapter/10.1007/978-3-030-05983-5_1,Conference paper
Mapping the Challenges of Outdoor Learning for Both Students and Teachers,"Digital Turn in Schools—Research, Policy, Practice",,,,10.1007/978-981-13-7361-9_4,Kadri MettisTerje Väljataga,2019,https://link.springer.com/chapter/10.1007/978-981-13-7361-9_4,Conference paper
JavaServer Pages,Java EE 8 Recipes,,,,10.1007/978-1-4842-3594-2_2,Josh Juneau,2018,https://link.springer.com/chapter/10.1007/978-1-4842-3594-2_2,Chapter
Error Handling,PHP 7 Zend Certification Study Guide,,,,10.1007/978-1-4842-3246-0_11,Andrew Beak,2017,https://link.springer.com/chapter/10.1007/978-1-4842-3246-0_11,Chapter
Issues Related to Damage Stability,Contemporary Ideas on Ship Stability,,,,10.1007/978-3-030-00516-0_42,Andrew Scott,2019,https://link.springer.com/chapter/10.1007/978-3-030-00516-0_42,Chapter
A New Framework for Personal Name Disambiguation,Intelligent Computing,,,,10.1007/978-3-030-01174-1_76,L. GeorgievaS. Buatongkue,2019,https://link.springer.com/chapter/10.1007/978-3-030-01174-1_76,Conference paper
The State of PHP,Typed PHP,,,,10.1007/978-1-4842-2114-3_1,Christopher Pitt,2016,https://link.springer.com/chapter/10.1007/978-1-4842-2114-3_1,Chapter
Server-Side Scripting Languages,Encyclopedia of Social Network Analysis and Mining,,,,10.1007/978-1-4939-7131-2_363,Ludger Martin,2018,https://link.springer.com/rwe/10.1007/978-1-4939-7131-2_363,Reference work entry
Functions,Beginning PHP and MySQL,,,,10.1007/978-1-4302-6044-8_4,Frank M. Kromann,2018,https://link.springer.com/chapter/10.1007/978-1-4302-6044-8_4,Chapter
Genetics of Obesity,Genetics of Endocrine Diseases and Syndromes,,,,10.1007/978-3-030-25905-1_19,Lotte KleinendorstMieke M. van HaelstErica L. T. van den Akker,2019,https://link.springer.com/chapter/10.1007/978-3-030-25905-1_19,Chapter
Segmenting User Sessions in Search Engine Query Logs Leveraging Word Embeddings,Digital Libraries for Open Knowledge,,,,10.1007/978-3-030-30760-8_17,Pedro GomesBruno MartinsLuís Cruz,2019,https://link.springer.com/chapter/10.1007/978-3-030-30760-8_17,Conference paper
Advanced Topics,Computing with the Raspberry Pi,,,,10.1007/978-1-4842-5293-2_7,Brian Schell,2019,https://link.springer.com/chapter/10.1007/978-1-4842-5293-2_7,Chapter
"Agrobacterium-Mediated Transformation of Solanum tuberosum L., Potato",Transgenic Plants,,,,10.1007/978-1-4939-8778-8_15,Myron A. BruceJessica L. Shoup Rupp,2019,https://link.springer.com/chapter/10.1007/978-1-4939-8778-8_15,Protocol
AndroParse - An Android Feature Extraction Framework and Dataset,Digital Forensics and Cyber Crime,,,,10.1007/978-3-030-05487-8_4,Robert SchmickerFrank BreitingerIbrahim Baggili,2019,https://link.springer.com/chapter/10.1007/978-3-030-05487-8_4,Conference paper
CrowdED and CREX: Towards Easy Crowdsourcing Quality Control Evaluation,Advances in Databases and Information Systems,,,,10.1007/978-3-030-28730-6_18,Tarek AwwadNadia BennaniVeronika Rehn-SonigoLionel BrunieHarald Kosch,2019,https://link.springer.com/chapter/10.1007/978-3-030-28730-6_18,Conference paper
"More Than Words: Ossi di seppia, Opera, and the Miracle of Counter-Eloquence",Echoes of Opera in Modern Italian Poetry,,,,10.1007/978-3-030-46091-4_4,Mattia Acetoso,2020,https://link.springer.com/chapter/10.1007/978-3-030-46091-4_4,Chapter
Security Risks from Vulnerabilities and Backdoors,Cyberspace Mimic Defense,,,,10.1007/978-3-030-29844-9_1,Jiangxing Wu,2020,https://link.springer.com/chapter/10.1007/978-3-030-29844-9_1,Chapter
DC Circuits,Passive Circuit Analysis with LTspice®,,,,10.1007/978-3-030-38304-6_2,Colin May,2020,https://link.springer.com/chapter/10.1007/978-3-030-38304-6_2,Chapter
Date and Time,Beginning PHP and MySQL,,,,10.1007/978-1-4302-6044-8_12,Frank M. Kromann,2018,https://link.springer.com/chapter/10.1007/978-1-4302-6044-8_12,Chapter
Vector-Borne Diseases,Biodiversity and Health in the Face of Climate Change,,,,10.1007/978-3-030-02318-8_4,Ruth MüllerFriederike ReussVladimir KendrovskiDoreen Montag,2019,https://link.springer.com/chapter/10.1007/978-3-030-02318-8_4,Chapter
Finishing the Game,Learning C# by Programming Games,,,,10.1007/978-3-662-59252-6_26,Wouter van TollArjan EggesJeroen D. Fokker,2019,https://link.springer.com/chapter/10.1007/978-3-662-59252-6_26,Chapter
Introducing PDO,Beginning PHP and MySQL,,,,10.1007/978-1-4302-6044-8_28,Frank M. Kromann,2018,https://link.springer.com/chapter/10.1007/978-1-4302-6044-8_28,Chapter
Early Dry-Cask Storage: A Safer Alternative to Dense-Packed Pools and Reprocessing,Plutonium,,,,10.1007/978-981-13-9901-5_6,Frank von HippelMasafumi TakuboJungmin Kang,2019,https://link.springer.com/chapter/10.1007/978-981-13-9901-5_6,Chapter
A New Architecture of Smart House Control System,Smart Computing and Communication,,,,10.1007/978-3-319-73830-7_8,Lianghai YangFeiqiao MaoJiaqi Tan,2018,https://link.springer.com/chapter/10.1007/978-3-319-73830-7_8,Conference paper
Strings and Patterns,PHP 7 Zend Certification Study Guide,,,,10.1007/978-1-4842-3246-0_3,Andrew Beak,2017,https://link.springer.com/chapter/10.1007/978-1-4842-3246-0_3,Chapter
"Elaborations, Developments, Justifications",Iceberg Semantics for Mass Nouns and Count Nouns,,,,10.1007/978-3-030-42711-5_11,Fred Landman,2020,https://link.springer.com/chapter/10.1007/978-3-030-42711-5_11,Chapter
Session Handlers,Beginning PHP and MySQL,,,,10.1007/978-1-4302-6044-8_17,Frank M. Kromann,2018,https://link.springer.com/chapter/10.1007/978-1-4302-6044-8_17,Chapter
The Controversy Concerning the Nature of the Sign,Morphogenesis of the Sign,,,,10.1007/978-3-319-89848-3_2,David Piotrowski,2018,https://link.springer.com/chapter/10.1007/978-3-319-89848-3_2,Chapter
