Item Title,Publication Title,Book Series Title,Journal Volume,Journal Issue,Item DOI,Authors,Publication Year,URL,Content Type
An Abstract Domain for Objects in Dynamic Programming Languages,Formal Methods. FM 2019 International Workshops,,,,10.1007/978-3-030-54997-8_9,Vincenzo ArceriMichele PasquaIsabella Mastroeni,2020,https://link.springer.com/chapter/10.1007/978-3-030-54997-8_9,Conference paper
Preparing Logistics for the Low-Carbon Economy,Global Logistics and Supply Chain Strategies for the 2020s,,,,10.1007/978-3-030-95764-3_6,Alan C. McKinnon,2023,https://link.springer.com/chapter/10.1007/978-3-030-95764-3_6,Chapter
Getting Started with AWS,Cloud Computing with AWS,,,,10.1007/978-1-4842-9172-6_2,Pravin Mishra,2023,https://link.springer.com/chapter/10.1007/978-1-4842-9172-6_2,Chapter
Agile Tools: Toolbox for Product Owners &amp; Agile Teams,Large-Scale Agile Frameworks,,,,10.1007/978-3-662-67782-7_7,Sascha Block,2023,https://link.springer.com/chapter/10.1007/978-3-662-67782-7_7,Chapter
Southern California’s Flipped Congressional Districts: Bumpy Roads to Reelection and Defeat,The Roads to Congress 2020,,,,10.1007/978-3-030-82521-8_5,Marcia L. Godwin,2022,https://link.springer.com/chapter/10.1007/978-3-030-82521-8_5,Chapter
Objects and Design,"PHP 8 Objects, Patterns, and Practice",,,,10.1007/978-1-4842-6791-2_6,Matt Zandstra,2021,https://link.springer.com/chapter/10.1007/978-1-4842-6791-2_6,Chapter
Detecting Vulnerabilities of Web Application Using Penetration Testing and Prevent Using Threat Modeling,"Advances in Electronics, Communication and Computing",,,,10.1007/978-981-15-8752-8_3,Sandip Sarkar,2021,https://link.springer.com/chapter/10.1007/978-981-15-8752-8_3,Conference paper
Theoretical Methods for Giant Resonances,Handbook of Nuclear Physics,,,,10.1007/978-981-19-6345-2_72,Gianluca Colò,2023,https://link.springer.com/rwe/10.1007/978-981-19-6345-2_72,Reference work entry
Smart Nutrition of Extensively Kept Ruminants,Smart Livestock Nutrition,,,,10.1007/978-3-031-22584-0_10,Luciano A. GonzálezJanine Chang-Fung-MartelJ. Augusto Imaz,2023,https://link.springer.com/chapter/10.1007/978-3-031-22584-0_10,Chapter
Understanding the Design Effects of Progress Indicators on Online Surveys,[   ] With Design: Reinventing Design Modes,,,,10.1007/978-981-19-4472-7_92,Wonyoung ParkJaemyung LeeSangsu Lee,2022,https://link.springer.com/chapter/10.1007/978-981-19-4472-7_92,Conference paper
"Wife, Child, Illegal: Static Representations of Filipinos in Japanese Manga",Transnationalism in East and Southeast Asian Comics Art,,,,10.1007/978-3-030-95243-3_11,Karl Ian Uy Cheng ChuaBenjamin A. San Jose,2022,https://link.springer.com/chapter/10.1007/978-3-030-95243-3_11,Chapter
Short Stature,Endocrine Conditions in Pediatrics,,,,10.1007/978-3-030-52215-5_40,Monica Serrano-Gonzalez,2021,https://link.springer.com/chapter/10.1007/978-3-030-52215-5_40,Chapter
Model Checking Temporal Properties of Recursive Probabilistic Programs,Foundations of Software Science and Computation Structures,,,,10.1007/978-3-030-99253-8_23,Tobias WinklerChristina GehnenJoost-Pieter Katoen,2022,https://link.springer.com/chapter/10.1007/978-3-030-99253-8_23,Conference paper
Figures of Speech: Stuck in the Middle with ‘People Like You’,Figure,,,,10.1007/978-981-19-2476-7_11,Celia Lury,2022,https://link.springer.com/chapter/10.1007/978-981-19-2476-7_11,Chapter
Surveillance and Disruption,"The Open World, Hackbacks and Global Justice",,,,10.1007/978-981-19-8132-6_6,A. Jean Thomas,2023,https://link.springer.com/chapter/10.1007/978-981-19-8132-6_6,Chapter
Mazes,The Essential Guide to HTML5,,,,10.1007/978-1-4842-8722-4_7,Jeanine Meyer,2023,https://link.springer.com/chapter/10.1007/978-1-4842-8722-4_7,Chapter
Breaking and Fixing Third-Party Payment Service for Mobile Apps,Applied Cryptography and Network Security,,,,10.1007/978-3-030-78375-4_1,Shangcheng ShiXianbo WangWing Cheong Lau,2021,https://link.springer.com/chapter/10.1007/978-3-030-78375-4_1,Conference paper
Individualized Educational System Supporting Object-Oriented Programming,"Advances in Software Engineering, Education, and e-Learning",,,,10.1007/978-3-030-70873-3_61,F. FischmanH. LerschM. WinterhagenB. WallenbornM. FuchsM. ThenM. Hemmje,2021,https://link.springer.com/chapter/10.1007/978-3-030-70873-3_61,Conference paper
Estimating the Traffic Density from Traffic Cameras,"Future Data and Security Engineering. Big Data, Security and Privacy, Smart City and Industry 4.0 Applications",,,,10.1007/978-981-16-8062-5_17,Vu Le Quynh  PhuongBui Nhat TaiNguyen Khac HuyTran Nguyen Minh ThuPham Nguyen Khang,2021,https://link.springer.com/chapter/10.1007/978-981-16-8062-5_17,Conference paper
Smart Self-Immolation Prediction Techniques: An Analytical Study for Predicting Suicidal Tendencies Using Machine Learning Algorithms,Smart IoT for Research and Industry,,,,10.1007/978-3-030-71485-7_4,Kaushik ChandaAhona GhoshSharmistha DeyRajesh BoseSandip Roy,2022,https://link.springer.com/chapter/10.1007/978-3-030-71485-7_4,Chapter
$$\mathbb {K}$$ -Smali: An Executable Semantics for&#xa0;Program Verification of&#xa0;Reversed Android Applications,Foundations and Practice of Security,,,,10.1007/978-3-031-08147-7_22,Marwa ZiadiaMohamed MejriJaouhar Fattahi,2022,https://link.springer.com/chapter/10.1007/978-3-031-08147-7_22,Conference paper
macOS Built-in Commands,Tweak Your Mac Terminal,,,,10.1007/978-1-4842-6171-2_3,Daniel Platt,2021,https://link.springer.com/chapter/10.1007/978-1-4842-6171-2_3,Chapter
Installing and Configuring Services,Secure Web Application Development,,,,10.1007/978-1-4842-8596-1_5,Matthew Baker,2022,https://link.springer.com/chapter/10.1007/978-1-4842-8596-1_5,Chapter
Protocol Buffers,Mobile Forensics – The File Format Handbook,,,,10.1007/978-3-030-98467-0_9,Chris Currier,2022,https://link.springer.com/chapter/10.1007/978-3-030-98467-0_9,Chapter
MicroProfile JWT,The Definitive Guide to Security in Jakarta EE,,,,10.1007/978-1-4842-7945-8_8,Arjan TijmsTeo BaisWerner Keil,2022,https://link.springer.com/chapter/10.1007/978-1-4842-7945-8_8,Chapter
Developer-Proof Prevention of SQL Injections,Foundations and Practice of Security,,,,10.1007/978-3-030-70881-8_6,Judicaël Courant,2021,https://link.springer.com/chapter/10.1007/978-3-030-70881-8_6,Conference paper
Hydrogen Embrittlement: Fundamentals,Hydrogen Embrittlement in Metals and Alloys,,,,10.1007/978-3-031-83681-7_2,Pasquale Cavaliere,2025,https://link.springer.com/chapter/10.1007/978-3-031-83681-7_2,Chapter
Blended Graphical and&#xa0;Textual Modelling of&#xa0;UML-RT State-Machines: An Industrial Experience,Software Architecture,,,,10.1007/978-3-031-15116-3_2,Malvina LatifajFederico CiccozziMuhammad Waseem AnwarMattias Mohlin,2022,https://link.springer.com/chapter/10.1007/978-3-031-15116-3_2,Conference paper
Utilizing Digitized Surveys for Data Collection: The Case of Developing Countries,"Proceedings of the Future Technologies Conference (FTC) 2020, Volume 3",,,,10.1007/978-3-030-63092-8_11,Abdullah SarhanOmar AddamJone RokneReda Alhajj,2021,https://link.springer.com/chapter/10.1007/978-3-030-63092-8_11,Conference paper
Novice Type Error Diagnosis with&#xa0;Natural Language Models,Programming Languages and Systems,,,,10.1007/978-3-031-21037-2_10,Chuqin GengHaolin YeYixuan LiTianyu HanBrigitte PientkaXujie Si,2022,https://link.springer.com/chapter/10.1007/978-3-031-21037-2_10,Conference paper
Wikibase as an Infrastructure for&#xa0;Knowledge Graphs: The EU Knowledge&#xa0;Graph,The Semantic Web – ISWC 2021,,,,10.1007/978-3-030-88361-4_37,Dennis DiefenbachMax De WildeSamantha Alipio,2021,https://link.springer.com/chapter/10.1007/978-3-030-88361-4_37,Conference paper
A Blockchain Based Online Voting System: An Indian Scenario,Advanced Informatics for Computing Research,,,,10.1007/978-981-16-3660-8_31,Srinivasan SelvarajP. Shobha  RaniA. GnanasekarVignaraj Anand,2021,https://link.springer.com/chapter/10.1007/978-981-16-3660-8_31,Conference paper
Tissue Microarray,Handbook of Practical Immunohistochemistry,,,,10.1007/978-3-030-83328-2_11,Myra L. WilkersonStephen Hewitt,2022,https://link.springer.com/chapter/10.1007/978-3-030-83328-2_11,Chapter
Interactive and Incentivized Online Experiments: Noncooperation in Give-Some and Take-Some Dilemmas,Experimental Philosophy for Beginners,,,,10.1007/978-3-031-58049-9_5,Marc Wyszynski,2024,https://link.springer.com/chapter/10.1007/978-3-031-58049-9_5,Chapter
"Vue.js in Depth: The Vue Instance, Vue Templates, and Data Binding",Building web applications with Vue.js,,,,10.1007/978-3-658-37596-6_4,Ralph Steyer,2022,https://link.springer.com/chapter/10.1007/978-3-658-37596-6_4,Chapter
String Abstract Domains and Their Combination,Logic-Based Program Synthesis and Transformation,,,,10.1007/978-3-030-98869-2_1,Harald Søndergaard,2022,https://link.springer.com/chapter/10.1007/978-3-030-98869-2_1,Conference paper
Generating Character-Based Templates for Log Data,Smart Log Data Analytics,,,,10.1007/978-3-030-74450-2_4,Florian SkopikMarkus WurzenbergerMax Landauer,2021,https://link.springer.com/chapter/10.1007/978-3-030-74450-2_4,Chapter
"Other Americas, Other Immigrants: “World Memory” and “World Literature” in Maryse Condé’s Desirada",Universal Localities,,,,10.1007/978-3-662-62332-9_7,Sara-Louise Cooper,2022,https://link.springer.com/chapter/10.1007/978-3-662-62332-9_7,Chapter
Bringing Forms to Life,PHP 7 Solutions,,,,10.1007/978-1-4842-4338-1_6,David Powers,2019,https://link.springer.com/chapter/10.1007/978-1-4842-4338-1_6,Chapter
Python Network Automation Virtual Lab 2: Sendmail Email Notification and Twilio SMS Notification on Docker,Introduction to Python Network Automation Volume II,,,,10.1007/979-8-8688-0391-8_7,Brendan Choi,2024,https://link.springer.com/chapter/10.1007/979-8-8688-0391-8_7,Chapter
Effect of Plastic Take-Out Container Attributes to Recycling Behavior,Convergence of Ergonomics and Design,,,,10.1007/978-3-030-63335-6_38,Wira MadriaJazmin TangsocEzekiel Bernardo,2021,https://link.springer.com/chapter/10.1007/978-3-030-63335-6_38,Conference paper
Design and Implementation of VxWorks System Vulnerability Mining Framework Based on Dynamic Symbol Execution,Proceedings of the 9th International Conference on Computer Engineering and Networks,,,,10.1007/978-981-15-3753-0_78,Wei ZhengYu ZhouBoheng Wang,2021,https://link.springer.com/chapter/10.1007/978-981-15-3753-0_78,Conference paper
Cine Joven: Sexual Diversity and New Technologies,Sexual Diversity in Young Cuban Cinema,,,,10.1007/978-3-031-18946-3_2,Margaret G. Frohlich,2023,https://link.springer.com/chapter/10.1007/978-3-031-18946-3_2,Chapter
Lightening Your Workload with Includes,PHP 7 Solutions,,,,10.1007/978-1-4842-4338-1_5,David Powers,2019,https://link.springer.com/chapter/10.1007/978-1-4842-4338-1_5,Chapter
Modularizing Laravel,Domain-Driven Laravel,,,,10.1007/978-1-4842-6023-4_8,Jesse Griffin,2021,https://link.springer.com/chapter/10.1007/978-1-4842-6023-4_8,Chapter
Introduction to Visual Studio Code,Optimizing Visual Studio Code for Python Development,,,,10.1007/978-1-4842-7344-9_1,Sufyan bin Uzayr,2021,https://link.springer.com/chapter/10.1007/978-1-4842-7344-9_1,Chapter
"The Visual Politics of Maralinga: Experiences, (Re)presentations, and Vulnerabilities",Connecting to the Living History of Radiation Exposure,,,,10.1007/978-3-031-18758-2_5,N. A. J. Taylor,2022,https://link.springer.com/chapter/10.1007/978-3-031-18758-2_5,Chapter
Hands-on Infrastructure as Code with Puppet,Introduction to Infrastructure as Code,,,,10.1007/978-1-4842-8689-0_7,Sneh PandyaRiya Guha Thakurta,2022,https://link.springer.com/chapter/10.1007/978-1-4842-8689-0_7,Chapter
Lower Bounds for QCDCL via Formula Gauge,Theory and Applications of Satisfiability Testing – SAT 2021,,,,10.1007/978-3-030-80223-3_5,Benjamin BöhmOlaf Beyersdorff,2021,https://link.springer.com/chapter/10.1007/978-3-030-80223-3_5,Conference paper
Versatile Metal–Organic Frameworks: Perspectives on Contribution in Reaction Catalysis and Applications,Metal-Organic Frameworks (MOFs) as Catalysts,,,,10.1007/978-981-16-7959-9_7,Sanjay KumarKartika GoyalMansiSweta KumariShikha Gulati,2022,https://link.springer.com/chapter/10.1007/978-981-16-7959-9_7,Chapter
Website Design and Implementation of Xunyang Lion’s Head Orange,The 2020 International Conference on Machine Learning and Big Data Analytics for IoT Security and Privacy,,,,10.1007/978-3-030-62746-1_86,YongHui Ma,2021,https://link.springer.com/chapter/10.1007/978-3-030-62746-1_86,Conference paper
Web Development,Beginning Machine Learning in the Browser,,,,10.1007/978-1-4842-6843-8_1,Nagender Suryadevara,2021,https://link.springer.com/chapter/10.1007/978-1-4842-6843-8_1,Chapter
Memoized Regular Expressions,Implementation and Application of Automata,,,,10.1007/978-3-030-79121-6_4,Brink van der MerweJacobie MoutonSteyn van LitsenborghMartin Berglund,2021,https://link.springer.com/chapter/10.1007/978-3-030-79121-6_4,Conference paper
Can Machines Have Their Own Consciousness?,Gamechanger AI,,,,10.1007/978-3-030-52897-3_4,Klaus Henning,2021,https://link.springer.com/chapter/10.1007/978-3-030-52897-3_4,Chapter
Age-Related Macular Degeneration (AMD): Non-neovascular and Neovascular AMD,Albert and Jakobiec's Principles and Practice of Ophthalmology,,,,10.1007/978-3-030-42634-7_111,Voraporn ChaikitmongkolSusan B. BresslerNeil M. Bressler,2022,https://link.springer.com/rwe/10.1007/978-3-030-42634-7_111,Reference work entry
Slots,Developing Web Components with TypeScript,,,,10.1007/978-1-4842-6840-7_6,Jörg Krause,2021,https://link.springer.com/chapter/10.1007/978-1-4842-6840-7_6,Chapter
Generating Thumbnail Images,PHP 7 Solutions,,,,10.1007/978-1-4842-4338-1_10,David Powers,2019,https://link.springer.com/chapter/10.1007/978-1-4842-4338-1_10,Chapter
Method of Creating a Passive Optical Network Monitoring System,Data-Centric Business and Applications,,,,10.1007/978-3-030-71892-3_16,Liubov TokarYana Krasnozheniuk,2021,https://link.springer.com/chapter/10.1007/978-3-030-71892-3_16,Chapter
Learn Python Basics on Windows,Introduction to Python Network Automation Volume I - Laying the Groundwork,,,,10.1007/979-8-8688-0146-4_2,Brendan Choi,2024,https://link.springer.com/chapter/10.1007/979-8-8688-0146-4_2,Chapter
Target Analysis of NPS in Oral Fluid,Methods for Novel Psychoactive Substance Analysis,,,,10.1007/978-1-0716-2605-4_7,Maria Rosaria VarìSimona PichiniSara MalacaAnnagiulia Di TranaNunzia La MaidaSilvia GrazianoGiulio MannocchiPietro BrunettiAlfredo Fabrizio Lo FaroFrancesco Paolo Busardò,2023,https://link.springer.com/chapter/10.1007/978-1-0716-2605-4_7,Protocol
Philosophy and Discussions,An Introduction to Programming Languages: Simultaneous Learning in Multiple Coding Environments,,,,10.1007/978-3-031-23277-0_2,Paul A. Gagniuc,2023,https://link.springer.com/chapter/10.1007/978-3-031-23277-0_2,Chapter
AWS Tools for .NET,Pro .NET on Amazon Web Services,,,,10.1007/978-1-4842-8907-5_2,William PenberthySteve Roberts,2023,https://link.springer.com/chapter/10.1007/978-1-4842-8907-5_2,Chapter
HTTP Hacks,Understanding Network Hacks,,,,10.1007/978-3-662-62157-8_7,Bastian Ballmann,2021,https://link.springer.com/chapter/10.1007/978-3-662-62157-8_7,Chapter
Automating Data Science,Metalearning,,,,10.1007/978-3-030-67024-5_14,Pavel BrazdilJan N. van RijnCarlos SoaresJoaquin Vanschoren,2022,https://link.springer.com/chapter/10.1007/978-3-030-67024-5_14,Chapter
From Simple to Structural Clones: Tapping the Benefits of Non-redundancy,Enterprise Information Systems,,,,10.1007/978-3-030-75418-1_26,Stan Jarzabek,2021,https://link.springer.com/chapter/10.1007/978-3-030-75418-1_26,Conference paper
Building a Validator,Pro PHP 8 MVC,,,,10.1007/978-1-4842-6957-2_5,Christopher Pitt,2021,https://link.springer.com/chapter/10.1007/978-1-4842-6957-2_5,Chapter
PyBit Forensic Investigation,A Practical Hands-on Approach to Database Forensics,,,,10.1007/978-3-031-16127-8_5,Benno KrauseKim-Kwang Raymond ChooNhien-An Le-Khac,2022,https://link.springer.com/chapter/10.1007/978-3-031-16127-8_5,Chapter
Analyzing Pedestrian Crossflow Through Complex Transfer Corridors,Advances in Information and Communication,,,,10.1007/978-3-030-73100-7_33,Emad FelembanFaizan Ur RehmanAkhlaq AhmadShoaib Shahzad Obaidi,2021,https://link.springer.com/chapter/10.1007/978-3-030-73100-7_33,Conference paper
Application Layer,Fundamentals of IoT Communication Technologies,,,,10.1007/978-3-030-70080-5_5,Rolando Herrero,2022,https://link.springer.com/chapter/10.1007/978-3-030-70080-5_5,Chapter
Using PHP with MySQL,Beginning PHP and MySQL,,,,10.1007/978-1-4302-6044-8_27,Frank M. Kromann,2018,https://link.springer.com/chapter/10.1007/978-1-4302-6044-8_27,Chapter
A Peek Under the Hood,Space Technology,,,,10.1007/978-3-031-34818-1_6,Ignacio Chechile,2023,https://link.springer.com/chapter/10.1007/978-3-031-34818-1_6,Chapter
Guide 2: Creating Your First TYPO3 Site,The TYPO3 Guidebook,,,,10.1007/978-1-4842-6525-3_6,Felicity BrandHeather McNameeJeffrey A. McGuire,2021,https://link.springer.com/chapter/10.1007/978-1-4842-6525-3_6,Chapter
Related Work and Our Approach,Terminology Saturation,,,,10.1007/978-981-16-8630-6_2,Victoria KosaVadim Ermolayev,2022,https://link.springer.com/chapter/10.1007/978-981-16-8630-6_2,Chapter
Sherali-Adams and the Binary Encoding of Combinatorial Principles,LATIN 2020: Theoretical Informatics,,,,10.1007/978-3-030-61792-9_27,Stefan DantchevAbdul GhaniBarnaby Martin,2020,https://link.springer.com/chapter/10.1007/978-3-030-61792-9_27,Conference paper
The ICC and the Symbolism Paradox: The Al Bashir Debacle and Putin’s War,The International Criminal Court and the Prosecution of Sitting Heads of State,,,,10.1007/978-3-031-54646-4_5,Mattia Cacciatori,2024,https://link.springer.com/chapter/10.1007/978-3-031-54646-4_5,Chapter
Geopolitics and the Environment: Anthropogenesis Versus Nature,The Overburdened Planet,,,,10.1007/978-3-032-01510-5_2,Paul Appleby,2025,https://link.springer.com/chapter/10.1007/978-3-032-01510-5_2,Chapter
Bio-Based Polyvinylchloride (PVC)-Related Blends,Polyvinylchloride-based Blends,,,,10.1007/978-3-030-78455-3_10,Raluca Nicoleta Darie-NitaMaria RâpăP. M. Visakh,2022,https://link.springer.com/chapter/10.1007/978-3-030-78455-3_10,Chapter
Phase 2: ADP (Analyze/Design/Plan),HYPERID - A Hybrid Methodology for Project Management and Product Development,,,,10.1007/978-3-662-66968-6_4,Arash Parsania,2024,https://link.springer.com/chapter/10.1007/978-3-662-66968-6_4,Chapter
Households,A Framework for Sustainability Thinking,,,,10.1007/978-3-031-79179-6_7,Jeremy Van AntwerpMatthew Kuperus Heun,2022,https://link.springer.com/chapter/10.1007/978-3-031-79179-6_7,Chapter
Development of the Craniofacial Blood Supply: Intracranial System,The Embryologic Basis of Craniofacial Structure,,,,10.1007/978-3-031-15636-6_6,Michael H. Carstens,2023,https://link.springer.com/chapter/10.1007/978-3-031-15636-6_6,Chapter
The Problematics of Representing Sense of Place,"Sense of Place, Identity and the Revisioning of Curriculum",,,,10.1007/978-981-99-4266-4_7,Terry Locke,2023,https://link.springer.com/chapter/10.1007/978-981-99-4266-4_7,Chapter
The Mission,The Startup Players Handbook,,,,10.1007/978-1-4842-9315-7_1,Charles EdgeChip PearsonAmy Larson Pearson,2023,https://link.springer.com/chapter/10.1007/978-1-4842-9315-7_1,Chapter
User Management and Permissions,Practical Internet Server Configuration,,,,10.1007/978-1-4842-6960-2_5,Robert La Lau,2021,https://link.springer.com/chapter/10.1007/978-1-4842-6960-2_5,Chapter
Towards a Better Understanding of (Partial Weighted) MaxSAT Proof Systems,Theory and Applications of Satisfiability Testing – SAT 2020,,,,10.1007/978-3-030-51825-7_16,Javier LarrosaEmma Rollon,2020,https://link.springer.com/chapter/10.1007/978-3-030-51825-7_16,Conference paper
Containerizing Your Environment,Software Engineering for Absolute Beginners,,,,10.1007/978-1-4842-6622-9_2,Nico Loubser,2021,https://link.springer.com/chapter/10.1007/978-1-4842-6622-9_2,Chapter
Introducing FileMaker,Learn FileMaker Pro 19,,,,10.1007/978-1-4842-6680-9_1,Mark Conway Munro,2021,https://link.springer.com/chapter/10.1007/978-1-4842-6680-9_1,Chapter
Loop Holes in Cookies and Their Technical Solutions for Web Developers,Recent Innovations in Computing,,,,10.1007/978-981-15-8297-4_41,Talwinder SinghBilal Ahmad Mantoo,2021,https://link.springer.com/chapter/10.1007/978-981-15-8297-4_41,Conference paper
Algorithmic Suite,Terminology Saturation,,,,10.1007/978-981-16-8630-6_4,Victoria KosaVadim Ermolayev,2022,https://link.springer.com/chapter/10.1007/978-981-16-8630-6_4,Chapter
Static Taint Analysis for JavaScript Programs,Tools and Methods of Program Analysis,,,,10.1007/978-3-030-71472-7_13,Nabil AlmashfiLunjin Lu,2021,https://link.springer.com/chapter/10.1007/978-3-030-71472-7_13,Conference paper
Are Albinos People like Us? Albinism and Social Exclusion in Ghana,Contemporary Discourses in Social Exclusion,,,,10.1007/978-3-031-18180-1_7,Francis Ethelbert Kwabena Benyah,2022,https://link.springer.com/chapter/10.1007/978-3-031-18180-1_7,Chapter
Working with Arrays,PHP 7 Solutions,,,,10.1007/978-1-4842-4338-1_8,David Powers,2019,https://link.springer.com/chapter/10.1007/978-1-4842-4338-1_8,Chapter
Data Objects,Learn PHP 8,,,,10.1007/978-1-4842-6240-5_7,Steve Prettyman,2020,https://link.springer.com/chapter/10.1007/978-1-4842-6240-5_7,Chapter
Getting Started with Python Programs in Visual Studio Code,Optimizing Visual Studio Code for Python Development,,,,10.1007/978-1-4842-7344-9_2,Sufyan bin Uzayr,2021,https://link.springer.com/chapter/10.1007/978-1-4842-7344-9_2,Chapter
Hosting and CI/CD,Software Engineering for Absolute Beginners,,,,10.1007/978-1-4842-6622-9_11,Nico Loubser,2021,https://link.springer.com/chapter/10.1007/978-1-4842-6622-9_11,Chapter
"Afghanistan Since 2001: US Geostrategic Ambitions, a Failed State, and the Return of the Taliban",The Post-American Middle East,,,,10.1007/978-3-031-29912-4_2,Guillaume BeaudRené-Eric Dagorn,2023,https://link.springer.com/chapter/10.1007/978-3-031-29912-4_2,Chapter
Cape Town and the Pursuit of Inclusion,Reframing the Role of Public Open Space,,,,10.1007/978-3-030-94323-3_4,Miriam Bodino,2022,https://link.springer.com/chapter/10.1007/978-3-030-94323-3_4,Chapter
DevOps with Azure SQL,Practical Azure SQL Database for Modern Developers,,,,10.1007/978-1-4842-6370-9_11,Davide MauriSilvano CorianiAnna HoffmanSanjay MishraJovan Popovic,2021,https://link.springer.com/chapter/10.1007/978-1-4842-6370-9_11,Chapter
Challenges and Opportunities When Integrating Artificial Intelligence in the Development of Library Management Systems,"Challenges and Opportunities to Develop Organizations Through Creativity, Technology and Ethics",,,,10.1007/978-3-030-43449-6_22,Emanuel ȚundreaFlaviu TurcuțSilvia L. Fotea,2020,https://link.springer.com/chapter/10.1007/978-3-030-43449-6_22,Conference paper
Superspreading and&#xa0;Heterogeneity in&#xa0;Epidemics,"Diffusive Spreading in Nature, Technology and Society",,,,10.1007/978-3-031-05946-9_23,Klaus Kroy,2023,https://link.springer.com/chapter/10.1007/978-3-031-05946-9_23,Chapter
Advanced Email,Practical Internet Server Configuration,,,,10.1007/978-1-4842-6960-2_14,Robert La Lau,2021,https://link.springer.com/chapter/10.1007/978-1-4842-6960-2_14,Chapter
"Umple-TL: A Model-Oriented, Dependency-Free Text Emission Tool",Model-Driven Engineering and Software Development,,,,10.1007/978-3-030-37873-8_6,Mahmoud Husseini OrabiAhmed Husseini OrabiTimothy C. Lethbridge,2020,https://link.springer.com/chapter/10.1007/978-3-030-37873-8_6,Conference paper
SoC Design Verification,A Practical Approach to VLSI System on Chip (SoC) Design,,,,10.1007/978-3-031-18363-8_7,Veena S. Chakravarthi,2022,https://link.springer.com/chapter/10.1007/978-3-031-18363-8_7,Chapter
Mobile Forensic Investigation for WhatsApp,Practical Forensic Analysis of Artifacts on iOS and Android Devices,,,,10.1007/978-1-4842-8026-3_9,Mohammed Moreb,2022,https://link.springer.com/chapter/10.1007/978-1-4842-8026-3_9,Chapter
Snowflake,The Azure Data Lakehouse Toolkit,,,,10.1007/978-1-4842-8233-5_2,Ron L’Esteve,2022,https://link.springer.com/chapter/10.1007/978-1-4842-8233-5_2,Chapter
Intelligent System for Assessing the Socio-economic Situation in the Region,Advances in Computational Collective Intelligence,,,,10.1007/978-3-030-88113-9_35,Sholpan JomartovaTalgat MazakovDaryn MukhaevAigerim MazakovaGauhar Tolegen,2021,https://link.springer.com/chapter/10.1007/978-3-030-88113-9_35,Conference paper
MySQL Extension Automatic Porting to PDO for PHP Migration and Security Improvement,Computer Information Systems and Industrial Management,,,,10.1007/978-3-319-99954-8_38,Fabio MondinAgostino Cortesi,2018,https://link.springer.com/chapter/10.1007/978-3-319-99954-8_38,Conference paper
Building C# Applications,Pro C# 9 with .NET 5,,,,10.1007/978-1-4842-6939-8_2,Andrew TroelsenPhillip Japikse,2021,https://link.springer.com/chapter/10.1007/978-1-4842-6939-8_2,Chapter
Automation of Poultry Production Monitoring Through Web Services,Technologies and Innovation,,,,10.1007/978-3-030-88262-4_13,Maritza Aguirre-MunizagaJorge Romero-SánchezJefferson Quinde-GonzabayTeresa Samaniego-Cobo,2021,https://link.springer.com/chapter/10.1007/978-3-030-88262-4_13,Conference paper
Preliminaries on Crisp and Fuzzy Relational Calculus,Relational Calculus for Actionable Knowledge,,,,10.1007/978-3-030-92430-0_4,Éloi BosséMichel Barès,2022,https://link.springer.com/chapter/10.1007/978-3-030-92430-0_4,Chapter
Advanced Spring Configuration and Spring Boot,Pro Spring 6 with Kotlin,,,,10.1007/978-1-4842-9557-1_4,Peter SpäthIuliana CosminaRob HarropChris Schaefer,2023,https://link.springer.com/chapter/10.1007/978-1-4842-9557-1_4,Chapter
